Input,Reponses,
Whats your favorite outdoor activity during summer?,I enjoy going hiking or having picnics in the park.,
Do you like to watch classic movies or modern ones?,"I like both, but classic movies have a certain charm.",
Have you ever participated in a charity event?,"Yes, I volunteered at a charity run a few years ago.",
Do you prefer vacationing in a quiet location or a busy one?,I prefer quiet places to relax and disconnect.,
Whats something you love about your current job or studies?,I enjoy the challenges and the opportunity to learn.,
Do you enjoy attending live theater or shows?,"Yes, live theater is such a unique and immersive experience.",
Are you someone who likes to explore new hobbies often?,"Yes, I enjoy trying new hobbies and finding new interests.",
Whats your favorite way to exercise?,I like running or doing yoga in the mornings.,
Have you ever been on a cruise?,"Yes, I went on a Mediterranean cruise, and it was beautiful.",
Do you like to spend your weekends relaxing or being productive?,I like to balance both depending on my mood.,
Whats one thing youd like to learn this year?,Id love to learn how to cook more international dishes.,
Do you enjoy attending educational workshops or seminars?,"Yes, I love gaining new knowledge and skills.",
Whats something you do to maintain a positive mindset?,I practice gratitude and meditation to stay positive.,
Are you someone who enjoys volunteering?,"Yes, I find it rewarding to help others in my community.",
Whats your favorite way to stay connected with family?,I like to video call them or send them messages regularly.,
Do you like trying new fashion trends?,"Yes, I like experimenting with new styles every season.",
Whats your favorite way to spend an afternoon?,"I enjoy reading, walking, or spending time with loved ones.",
Do you enjoy working in a team or independently?,"I enjoy both, but I prefer working independently when I can focus.",
Have you ever attended a motivational event or seminar?,"Yes, I went to a motivational seminar that really inspired me.",
Do you enjoy watching reality shows or documentaries more?,I prefer documentaries; theyre more informative and interesting.,
Whats something that makes you feel accomplished?,Completing a big project or goal makes me feel proud.,
Are you someone who enjoys cooking or baking more?,"I enjoy both, but I tend to bake more often.",
Whats one thing youd like to change about your routine?,Id like to wake up earlier to have more time in the morning.,
Do you enjoy spending time in the countryside?,"Yes, I love the fresh air and peaceful atmosphere.",
Do you prefer summer or winter?,I prefer summer because I love the warm weather and outdoor activities.,
Do you enjoy watching TV shows or movies more?,"I enjoy both, but I tend to watch more movies than TV shows.",
Whats your favorite thing to do during the weekends?,"I enjoy spending time outdoors, whether its hiking or just relaxing in nature.",
Have you ever taken a cooking class?,"Yes, I took a baking class once and learned how to make delicious pastries.",
Do you like exploring new cuisines or sticking to your favorites?,"I enjoy exploring new cuisines, especially trying different types of Asian food.",
Are you a morning person or a night owl?,Im a morning person; I like getting an early start to the day.,
Do you enjoy playing video games?,"Yes, I play occasionally, especially action or adventure games.",
Whats your favorite way to relax after a long day?,I like to take a bath and read a good book to unwind.,
Do you enjoy outdoor sports like cycling or running?,"Yes, I enjoy both; cycling is a great way to explore, and running helps clear my mind.",
Whats something youd like to accomplish in the next year?,I want to travel to a new country and explore its culture.,
Do you enjoy spending time at the beach or in the mountains?,"I love the beach for relaxation, but the mountains are great for hiking and adventure.",
Do you prefer eating out or cooking at home?,I prefer cooking at home because I can control what goes into the meal.,
Are you someone who enjoys keeping a journal or diary?,"Yes, I find it helpful for reflecting and organizing my thoughts.",
Do you like visiting museums or art galleries?,"Yes, I enjoy both as they provide insight into history and creativity.",
Whats your favorite season of the year?,"I love fall for the crisp air, beautiful leaves, and cozy atmosphere.",
Do you enjoy working in a quiet space or with background noise?,I work best in a quiet space with no distractions.,
Are you someone who likes to attend social events often?,"Not too often, but I enjoy occasional gatherings with close friends.",
Whats one hobby youve always wanted to try?,Ive always wanted to try pottery or ceramic art.,
Do you enjoy trying new workout routines?,"Yes, I like switching up my workouts to keep things interesting.",
Are you someone who prefers a structured routine or flexibility?,"I prefer flexibility, but I still enjoy having some structure in my day.",
Do you enjoy hiking or walking in nature?,"Yes, I love both; hiking is great for adventure, and walking is perfect for relaxation.",
Have you ever gone camping in the wilderness?,"Yes, I went camping last summer, and it was a great experience.",
Do you like to drink coffee or tea in the morning?,"I usually drink tea, but sometimes I enjoy a cup of coffee for a boost.",
Are you someone who enjoys gardening or taking care of plants?,"Yes, I find it very rewarding to care for my plants and watch them grow.",
Whats your favorite type of music?,I love listening to indie music and acoustic songs.,
Do you like watching sports with friends or alone?,I enjoy watching sports with friendsits more fun that way.,
Whats one goal youre currently working towards?,Im working towards improving my fitness and health.,
Do you enjoy trying new restaurants?,"Yes, I love trying new places, especially if they have unique dishes.",
Are you someone who likes to plan vacations months in advance?,"I like to plan ahead, but I also enjoy spontaneous trips.",
Whats your favorite way to spend a holiday?,"I love spending the holiday with family, enjoying good food and games.",
Do you enjoy taking road trips?,"Yes, road trips are a fun way to explore new places.",
Do you prefer reading novels or listening to audiobooks?,"I enjoy reading novels, but I listen to audiobooks while traveling.",
Are you someone who likes to be active throughout the day?,"Yes, I like to keep busy, whether its working, exercising, or doing something productive.",
Whats your favorite activity to do with family?,I enjoy cooking and having meals together with my family.,
Do you like participating in group activities or prefer solo activities?,I enjoy both; it depends on my mood.,
Whats something you like to do on a lazy day?,I like to relax with a movie or binge-watch a TV series.,
Do you enjoy attending parties or social gatherings?,"I enjoy social gatherings with close friends, but large parties arent really my thing.",
Whats one of your favorite childhood games or activities?,I loved playing board games and riding my bike around the neighborhood.,
Do you like visiting new places in your own city?,"Yes, I enjoy discovering hidden gems and new spots in my city.",
Whats one thing you enjoy most about your job?,I love the creative challenges and the chance to learn something new every day.,
Are you someone who enjoys trying out new beauty products?,"Yes, I like experimenting with different skincare products.",
Do you like cooking traditional recipes or experimenting with new ones?,"I enjoy both, but I love trying out new recipes.",
Whats your favorite way to stay healthy?,I stay healthy by eating balanced meals and exercising regularly.,
Do you enjoy doing puzzles or playing games that make you think?,"Yes, I love brain teasers and puzzles; they keep my mind sharp.",
Are you someone who prefers watching movies at home or in theaters?,"I prefer watching movies at home, but theaters are great for big releases.",
Do you like trying new activities or sticking to familiar ones?,"I enjoy trying new activities, as long as theyre interesting.",
Whats one place youd love to visit someday?,Id love to visit the Maldives for its beautiful beaches and clear waters.,
Do you like taking part in local community events?,"Yes, I enjoy being involved and meeting new people.",
Are you someone who enjoys hiking or visiting parks?,"Yes, I enjoy both; being outdoors is very refreshing.",
Do you prefer spending time with close friends or meeting new people?,"I enjoy spending time with close friends, but I like meeting new people too.",
Whats your favorite type of cuisine to eat?,"I love Italian food, especially pasta and pizza.",
Do you enjoy watching comedy shows?,"Yes, I love comedy shows that make me laugh out loud.",
Whats one of your favorite hobbies to do alone?,"I love reading and writing, theyre great solitary activities.",
Whats your favorite way to stay active?,I love going for runs and doing yoga in the mornings.,
Do you enjoy spending time at the beach or in the mountains?,"I love both; the beach is relaxing, but the mountains offer great hikes.",
Do you prefer spending time alone or with others?,"I enjoy both, but I tend to recharge by spending time alone.",
Whats your favorite type of movie?,"I enjoy thrillers and mystery films, as they keep me on the edge of my seat.",
Do you enjoy cooking or baking more?,"I enjoy both, but I love baking because its so creative.",
Are you a fan of trying new restaurants or cooking at home?,"I love trying new restaurants for variety, but I enjoy cooking at home too.",
Have you ever been on a road trip?,"Yes, I went on a road trip across the country with friends last year.",
Do you like to spend time in nature?,"Yes, I love spending time outdoors, especially in quiet places like parks or the beach.",
Whats something youve always wanted to learn?,Ive always wanted to learn how to play the piano.,
Do you enjoy going to concerts or music festivals?,"Yes, I love the energy of live music at concerts or festivals.",
Whats your favorite thing to do on weekends?,I love spending weekends exploring new places or relaxing with friends.,
Do you like visiting museums or art galleries?,"Yes, I enjoy visiting both to explore history and creativity.",
Do you enjoy traveling alone or with a group?,"I like both; traveling alone gives me more freedom, but group trips are fun too.",
Do you enjoy trying out new hobbies?,"Yes, I enjoy trying new hobbies to discover new interests.",
Whats your favorite activity to do with friends?,I enjoy going to the movies or having game nights with friends.,
Do you prefer reading fiction or non-fiction books?,I prefer fiction books as they allow me to escape into different worlds.,
Have you ever done any volunteer work?,"Yes, Ive volunteered at a food bank and it was a rewarding experience.",
Whats your favorite way to unwind after a busy day?,I like to take a walk in the park and listen to music to relax.,
Do you enjoy gardening or taking care of plants?,"Yes, I find gardening very therapeutic and satisfying.",
Do you prefer a relaxing vacation or an adventurous one?,I prefer a mix of both; I enjoy relaxing with some adventure mixed in.,
Are you someone who enjoys public speaking or prefers to stay behind the scenes?,I enjoy public speaking; its exciting and gives me the chance to connect with people.,
Whats your favorite season and why?,I love autumn because of the cooler weather and beautiful fall foliage.,
Do you like attending social events or prefer smaller gatherings?,I enjoy smaller gatherings with close friends for more meaningful conversations.,
Do you enjoy taking photographs or videos during trips?,"Yes, I love capturing moments through photos during my travels.",
Are you someone who enjoys being on the go or relaxing at home?,"I enjoy both, but I like having time to relax and recharge at home.",
Whats your favorite type of workout?,"I enjoy running because it helps clear my mind, and strength training for building muscle.",
Do you like visiting new places or revisiting your favorite spots?,"I enjoy both, but theres something special about revisiting familiar places.",
Whats something youve done recently that youre proud of?,I recently completed a challenging project at work and felt great about it.,
Do you like staying organized or letting things unfold naturally?,"I like staying organized, as it helps me stay on top of everything.",
Whats one of your favorite family traditions?,I love our annual holiday dinners where we all gather and share stories.,
Do you enjoy experimenting with new recipes?,"Yes, I love trying new ingredients and cuisines to expand my cooking skills.",
Do you prefer spending time indoors or outdoors?,"I enjoy both, but I spend a lot of time outdoors when the weather is nice.",
Whats your favorite type of workout routine?,I love circuit training because its challenging and keeps me engaged.,
Do you enjoy doing DIY projects around the house?,"Yes, I enjoy fixing things and creating useful items for my home.",
Do you prefer watching TV shows or movies?,"I enjoy both, but I tend to watch more movies when I have free time.",
Whats your favorite way to relax on a Sunday afternoon?,I like to relax with a good book or watch a movie to unwind.,
Are you someone who enjoys trying new beauty products?,"Yes, I enjoy testing out new skincare products to see what works best for me.",
Do you like spending time with family or friends more?,"I enjoy both, but I tend to spend more time with my family.",
Whats one place youd love to visit in the future?,Id love to visit Japan to experience its rich culture and beautiful landscapes.,
Do you enjoy participating in charity events?,"Yes, I enjoy volunteering and supporting causes that are important to me.",
Whats one of your favorite childhood memories?,I remember going camping with my family every summer; those were great times.,
Do you like watching documentaries or dramas more?,I love watching documentaries because they teach me something new.,
Do you prefer spending your free time being active or relaxing?,I enjoy both; I like to balance active hobbies with relaxation.,
Whats one hobby youve recently picked up?,"I recently started knitting, and its been a fun and calming activity.",
Do you like to plan your vacations ahead of time or go with the flow?,I prefer planning my vacations in advance so I can make the most of my time there.,
Whats your favorite way to stay healthy?,"I stay healthy by eating balanced meals, staying active, and getting enough sleep.",
Do you like spending time in cities or in nature more?,"I enjoy both; cities have so much to offer, but nature helps me recharge.",
Whats one thing you always carry with you when you travel?,I always carry a camera to capture memories during my trips.,
Do you prefer staying in a hotel or renting an Airbnb?,"I like both; hotels offer luxury, but Airbnb gives a more local, homey feel.",
Whats your favorite way to stay productive?,I stay productive by creating a to-do list and breaking tasks into smaller steps.,
Do you enjoy playing sports or watching them more?,"I enjoy playing sports, especially soccer, but I also love watching big games.",
Whats something you like to do on a rainy day?,I love staying indoors and watching movies or reading a good book.,
Do you like doing puzzles or playing games that require thinking?,"Yes, I enjoy doing both; they help me relax and engage my mind.",
how are you ,"I'm doing well, thank you!",
how are you ,"I'm good, how about you?",
how are you ,"I'm great, thanks for asking!",
how are you ,"Doing alright, how about you?",
how are you ,"I'm fine, hows everything with you?",
how are you ,Everythings going good!,
how are you ,"Im doing okay, thanks for asking!",
how are you ,Couldnt be better!,
how are you ,"Im doing fantastic, thanks!",
how are you ,I'm feeling great today!,
how are you ,"I'm doing wonderful, how about you?",
how are you ,"I'm doing well, and yourself?",
how are you ,"I'm doing pretty well, thanks!",
how are you ,"I'm in good spirits, thanks!",
how are you ,"I'm doing just fine, thanks for checking!",
how are you ,Feeling awesome today!,
how are you ,"Im good, thanks for asking!",
how are you ,I'm feeling pretty good!,
how are you ,"Things are going smoothly, thanks!",
how are you ,"I'm in a great mood, how about you?",
how are you ,"Im okay, nothing special today!",
how are you ,I'm doing better than yesterday!,
how are you ,I feel amazing today!,
how are you ,Im doing as well as I can be!,
how are you ,"Im doing great, hows your day going?",
how are you ,I'm feeling on top of the world!,
how are you ,"I'm hanging in there, how about you?",
how are you ,"Im surviving, how are you?",
how are you ,"Im managing, thanks for asking!",
how are you ,Im doing as good as can be expected!,
how are you ,Everythings great on my end!,
how are you ,"Im just fine, hows life with you?",
how are you ,"Could be worse, but Im doing okay!",
how are you ,"I'm doing alright, thanks for asking!",
how are you ,I'm feeling pretty energized!,
how are you ,"Im doing awesome today, thanks!",
how are you ,Im feeling calm and collected!,
how are you ,"I'm doing very well, thank you!",
how are you ,"Im good, just a little tired!",
how are you ,"Im doing well, just keeping busy!",
how are you ,Im feeling pretty chill!,
how are you ,Everythings going great here!,
how are you ,"Im doing just fine, and yourself?",
how are you ,Im in a peaceful mood today!,
how are you ,"Im doing amazing, thanks for asking!",
how are you ,Im doing better than expected!,
how are you ,"Im doing quite well, thanks!",
how are you ,"Things are going well, thanks for asking!",
how are you ,"Im doing fantastic, hows your day?",
how are you ,"Feeling good, thanks for checking in!",
hello,Hello!,
hello,Hi there!,
hello,Hey!,
hello,Greetings!,
hello,Howdy!,
hello,"Hi, how are you?",
hello,What's up?,
hello,Good day!,
hello,Hey there!,
hello,How's it going?,
hello,Yo!,
hello,What's good?,
hello,"Hi, nice to see you!",
hello,Hows everything?,
hello,What's happening?,
hello,"Hi, long time no see!",
hello,Hello there!,
hello,"Hey, what's up?",
hello,"Hi, it's great to see you!",
hello,What's new?,
hello,How are you doing?,
hello,"Hello, hows your day?",
hello,"Hey, hows it going?",
hello,Salutations!,
hello,"Hi, how's life?",
hello,Whats crackin?,
hello,Aloha!,
hello,Bonjour!,
hello,Hola!,
hello,"Hi, hope you're doing well!",
hello,How's everything going?,
hello,What's the good word?,
hello,"Hi, how have you been?",
hello,"Hey, whats happening?",
hello,What's up with you?,
hello,"Hi, its a pleasure to meet you!",
hello,What's new with you?,
hello,"Yo, hows everything?",
hello,"Hi, all good?",
hello,Greetings and salutations!,
hello,"Hi, how's your day going so far?",
hello,"Hello, hows everything on your end?",
hello,"Hey, how have you been?",
hello,"Hi, whats going on today?",
hello,Hows your day treating you?,
hello,"Yo, what's good with you?",
hello,"Hi, hows the world treating you?",
hello,"Hey, whats up with you today?",
hello,"Hello, how are things going?",
hello,Hows your day going so far?,
Thank you,Thank you!,
Thank you,Thanks a lot!,
Thank you,Many thanks!,
Thank you,Thanks so much!,
Thank you,Thank you very much!,
Thank you,I really appreciate it!,
Thank you,Im grateful!,
Thank you,Thanks a ton!,
Thank you,Thanks a million!,
Thank you,I cant thank you enough!,
Thank you,I appreciate it!,
Thank you,Im truly thankful!,
Thank you,Im very grateful!,
Thank you,Much appreciated!,
Thank you,Im so thankful!,
Thank you,I appreciate your help!,
Thank you,Thanks for everything!,
Thank you,Thanks for your time!,
Thank you,Im deeply grateful!,
Thank you,Im really thankful!,
Thank you,Thank you kindly!,
Thank you,Im so appreciative!,
Thank you,I cant express how thankful I am!,
Thank you,Thanks a bunch!,
Thank you,Im truly appreciative!,
Thank you,Many thanks to you!,
Thank you,Thanks for your support!,
Thank you,Im really thankful for that!,
Thank you,You have my gratitude!,
Thank you,Im forever grateful!,
Thank you,Thank you so much for that!,
Thank you,I cant thank you enough for this!,
Thank you,Thanks for being so helpful!,
Thank you,Thanks for all your help!,
Thank you,I really appreciate your kindness!,
Thank you,Im thankful beyond words!,
Thank you,Thanks for thinking of me!,
Thank you,"Youre a lifesaver, thank you!",
Thank you,Im so grateful for your help!,
Thank you,Thanks for going the extra mile!,
Thank you,Thank you for everything you do!,
Thank you,Im beyond grateful!,
Thank you,I really appreciate your generosity!,
Thank you,Im grateful for your time!,
Thank you,Thank you from the bottom of my heart!,
Thank you,Thanks for all the effort youve put in!,
Thank you,"Youre amazing, thank you!",
Thank you,Im so thankful for your support!,
Thank you,Thanks a lot for that!,
Thank you,"Im so lucky to have you, thanks!",
Thank you,I cant tell you how much I appreciate this!,
You are welcome,You're also welcome,
You are welcome,No problem!,
You are welcome,My pleasure!,
You are welcome,Anytime!,
You are welcome,It was nothing!,
You are welcome,Dont mention it!,
You are welcome,Glad to help!,
You are welcome,Happy to help!,
You are welcome,Its the least I could do!,
You are welcome,Im happy to assist!,
You are welcome,No worries!,
You are welcome,It was my pleasure!,
You are welcome,Any time!,
You are welcome,You got it!,
You are welcome,Of course!,
You are welcome,Its all good!,
You are welcome,I'm happy to!,
You are welcome,I'm glad I could help!,
You are welcome,Absolutely!,
You are welcome,Not at all!,
You are welcome,No trouble at all!,
You are welcome,Im always here to help!,
You are welcome,Im delighted to help!,
You are welcome,It was a pleasure!,
You are welcome,Youre very welcome!,
You are welcome,Consider it done!,
You are welcome,Thats what Im here for!,
You are welcome,"Anytime, happy to help!",
You are welcome,Its nothing at all!,
You are welcome,It was a pleasure to assist!,
You are welcome,Im happy I could help!,
You are welcome,You dont have to thank me!,
You are welcome,Glad I could be of assistance!,
You are welcome,All in a days work!,
You are welcome,Just doing my job!,
You are welcome,Youre most welcome!,
You are welcome,Im glad I could be of service!,
You are welcome,Happy to be of help!,
You are welcome,Thats what friends are for!,
You are welcome,It was no big deal!,
You are welcome,Always happy to lend a hand!,
You are welcome,Im glad you asked!,
You are welcome,"Youre welcome, anytime!",
You are welcome,"It was nothing, really!",
You are welcome,Im pleased I could help!,
You are welcome,Sure thing!,
You are welcome,Don't worry about it!,
You are welcome,Im just glad youre happy!,
You are welcome,Its all part of the job!,
You are welcome,"Youre welcome, glad I could assist!",
Hows your day going,"Its going well, thanks!",
Hows your day going,My days going pretty great!,
Hows your day going,Its been a good day so far!,
Hows your day going,Everythings going smoothly!,
Hows your day going,"Its going alright, how about yours?",
Hows your day going,"Its been a busy day, but good!",
Hows your day going,"So far, so good!",
Hows your day going,My days been pretty chill.,
Hows your day going,Its been a productive day!,
Hows your day going,"Cant complain, its going well!",
Hows your day going,Its been a pretty nice day.,
Hows your day going,"My days been going fine, thanks!",
Hows your day going,"Its going great, how about yours?",
Hows your day going,"Its been a busy day, but productive!",
Hows your day going,"So far, its been a relaxing day.",
Hows your day going,"Things are going well, thanks for asking!",
Hows your day going,Ive been having a pretty good day!,
Hows your day going,"Its been a little hectic, but okay!",
Hows your day going,My days been pretty uneventful so far.,
Hows your day going,"Its been going pretty well, thank you!",
Hows your day going,Its been a mix of busy and relaxing.,
Hows your day going,"My days been great, hows yours going?",
Hows your day going,"Its been a smooth day, cant complain!",
Hows your day going,"Its been a calm day, thank you for asking!",
Hows your day going,Everythings going pretty well today.,
Hows your day going,Its been a productive and rewarding day!,
Hows your day going,Its been a fun day so far!,
Hows your day going,"Its been a good day, just staying busy.",
Hows your day going,"Pretty good, thanks! Hows yours?",
Hows your day going,"Its been going alright, nothing too exciting.",
Hows your day going,Its going better than expected!,
Hows your day going,"Its going okay, could be better though.",
Hows your day going,My days been pretty laid back.,
Hows your day going,"Ive had a pretty chill day, how about you?",
Hows your day going,"Its been an exhausting day, but good!",
Hows your day going,Its been a productive afternoon!,
Hows your day going,"My days been full of meetings, but good!",
Hows your day going,Its been a bit of a rollercoaster today!,
Hows your day going,Everythings going pretty smoothly.,
Hows your day going,Its been a relaxing day with no stress.,
Hows your day going,"Im having a pretty great day, thanks!",
Hows your day going,"Its been a little tiring, but alright!",
Hows your day going,"My days been going really well, thanks!",
Hows your day going,Its been a fun and busy day!,
Hows your day going,"My days been pretty peaceful, thanks!",
Hows your day going,"Its been a productive, albeit tiring, day.",
Hows your day going,"Its going wonderfully, thanks for asking!",
Hows your day going,Its been a crazy but good day!,
